Questions,Answers
"What is DevOps?","DevOps is a set of practices and cultural philosophies that aim to improve collaboration between development and operations teams, streamline software delivery, and enhance continuous integration and deployment."
"What are the key principles of DevOps?","Key principles include continuous integration and delivery, automation of processes, collaboration and communication between teams, monitoring and logging, and infrastructure as code."
"What is continuous integration (CI)?","Continuous integration is a practice where code changes are automatically tested and integrated into the main codebase frequently, allowing for early detection of issues."
"What is continuous delivery (CD)?","Continuous delivery extends continuous integration by automatically deploying code changes to staging or production environments, ensuring that the software is always in a deployable state."
"What is infrastructure as code (IaC)?","Infrastructure as code is the practice of managing and provisioning computing infrastructure using code and automation tools, enabling consistent and repeatable environment setups."
"What are some common tools used for continuous integration?","Common CI tools include Jenkins, Travis CI, CircleCI, GitLab CI, and Bamboo."
"What is containerization, and why is it important?","Containerization involves packaging an application and its dependencies into a container, ensuring consistency across different environments and simplifying deployment."
"What is Docker, and how does it relate to DevOps?","Docker is a platform for building, deploying, and managing containers. It helps in creating reproducible and consistent environments for development, testing, and production."
"What is Kubernetes, and what role does it play in DevOps?","Kubernetes is an open-source platform for automating container orchestration and management. It helps in deploying, scaling, and managing containerized applications efficiently."
"What is the difference between a virtual machine (VM) and a container?","A VM is a full operating system instance running on hypervisor software, while a container shares the host OS kernel and is more lightweight, enabling faster and more efficient deployment."
"What is a microservices architecture?","Microservices architecture breaks down an application into small, independent services that communicate through APIs, allowing for better scalability, flexibility, and maintainability."
"What is configuration management, and why is it important?","Configuration management involves maintaining and managing system configurations to ensure consistency and compliance across environments. Tools like Ansible, Puppet, and Chef are used for this purpose."
"What are some common monitoring and logging tools used in DevOps?","Common tools include Prometheus, Grafana, ELK Stack (Elasticsearch, Logstash, Kibana), Splunk, and Nagios."
"What is a deployment pipeline?","A deployment pipeline is a series of automated processes that code changes go through, including building, testing, and deploying, to ensure they meet quality standards before being released."
"What is the role of automated testing in DevOps?","Automated testing ensures that code changes are tested quickly and consistently, reducing the risk of bugs and improving the reliability of deployments."
"What are some common challenges faced in DevOps implementation?","Challenges include cultural resistance, tool integration issues, managing complex environments, ensuring security, and maintaining consistent practices across teams."
"What is version control, and why is it important in DevOps?","Version control tracks changes to source code over time, allowing for collaboration, code management, and rollback capabilities. Tools like Git and SVN are commonly used."
"What is a rollback, and when would you use it?","A rollback is the process of reverting to a previous version of software or configuration to undo changes that caused issues or failures."
"What is blue-green deployment?","Blue-green deployment is a strategy that involves maintaining two identical production environments (blue and green) and switching traffic between them to minimize downtime during updates."
"What is canary deployment?","Canary deployment involves rolling out changes to a small subset of users or servers before a full-scale deployment, allowing for monitoring and validation of new features or fixes."
"What is a service mesh, and how does it benefit microservices?","A service mesh provides a dedicated infrastructure layer for managing communication between microservices, offering features like traffic management, security, and observability."
"What is the role of security in DevOps (DevSecOps)?","DevSecOps integrates security practices into the DevOps pipeline, ensuring that security is considered at every stage of development and deployment, reducing vulnerabilities and risks."
"What are some best practices for managing secrets in DevOps?","Best practices include using secret management tools (e.g., HashiCorp Vault), encrypting sensitive information, and restricting access based on the principle of least privilege."
"What is an artifact repository, and why is it used?","An artifact repository is a storage system for binary files, libraries, and other build artifacts used in the software development lifecycle, facilitating version control and management."
"What is a load balancer, and how does it improve application availability?","A load balancer distributes incoming network traffic across multiple servers, improving application availability and reliability by preventing any single server from becoming a bottleneck."
"What is the role of a DevOps Engineer in a CI/CD pipeline?","A DevOps Engineer designs, implements, and maintains CI/CD pipelines, automating the processes of integration, testing, and deployment to ensure efficient and reliable software delivery."
"What is cloud computing, and how does it relate to DevOps?","Cloud computing provides on-demand access to computing resources over the internet. It supports DevOps practices by offering scalable, flexible, and cost-effective infrastructure for development and deployment."
"What is serverless architecture, and how does it impact DevOps?","Serverless architecture allows developers to build and deploy applications without managing servers, focusing on code execution and scaling automatically, simplifying operations and reducing infrastructure management."
"What is the significance of continuous feedback in DevOps?","Continuous feedback ensures that issues are identified and addressed early in the development process, improving quality, accelerating delivery, and aligning the final product with user needs."
"What are some common practices for ensuring high availability and disaster recovery in DevOps?","Practices include using redundant systems, implementing automated backups, deploying across multiple regions or data centers, and testing disaster recovery plans regularly."
"What is the role of API management in a DevOps environment?","API management involves designing, securing, and monitoring APIs to ensure they are reliable, scalable, and efficient, supporting seamless communication between microservices and external systems."
