Questions,Answers
"What is the role of a Senior Analyst?","A Senior Analyst is responsible for analyzing complex data sets to provide actionable insights, develop strategies, and guide decision-making within an organization."
"What skills are essential for a Senior Analyst?","Essential skills include advanced data analysis, proficiency in statistical tools and programming languages (e.g., SQL, Python, R), data visualization, and strong problem-solving abilities."
"How do you approach data analysis for a new project?","Start by understanding the project goals, collect and clean the data, perform exploratory data analysis, apply appropriate analytical techniques, and present the findings with clear recommendations."
"What is the difference between descriptive, diagnostic, predictive, and prescriptive analytics?","Descriptive analytics explains what has happened, diagnostic analytics explains why it happened, predictive analytics forecasts what might happen, and prescriptive analytics suggests actions to take."
"How do you handle large datasets efficiently?","Use techniques such as data sampling, parallel processing, database indexing, and distributed computing frameworks like Hadoop or Spark to manage and analyze large datasets."
"What is a key performance indicator (KPI), and how do you choose the right ones?","A KPI is a measurable value that indicates how effectively an organization is achieving key business objectives. Choose KPIs based on their relevance to strategic goals, measurability, and ability to drive performance."
"How do you ensure the accuracy and reliability of your data analysis?","Ensure accuracy by validating data sources, performing data cleaning, using reliable statistical methods, and cross-checking results with different techniques or data sets."
"What are the common challenges faced in data analysis, and how do you overcome them?","Common challenges include data quality issues, missing data, and integrating data from multiple sources. Overcome them by using data cleaning techniques, imputation methods, and ensuring consistent data formats."
"What is the significance of data visualization in reporting?","Data visualization helps to present complex data in a more understandable and visually appealing format, making it easier for stakeholders to grasp insights and make informed decisions."
"How do you prioritize tasks and projects as a Senior Analyst?","Prioritize tasks based on their impact on business goals, deadlines, resource availability, and stakeholder needs. Use project management techniques to organize and track progress."
"How do you communicate findings to non-technical stakeholders?","Translate technical findings into clear, actionable insights using simple language, visual aids, and storytelling to make the information more relatable and understandable."
"What is the role of statistical analysis in decision-making?","Statistical analysis helps in understanding data patterns, relationships, and trends, providing a basis for making data-driven decisions and reducing uncertainty in business strategies."
"What are some common statistical techniques used in data analysis?","Common techniques include hypothesis testing, regression analysis, correlation analysis, and analysis of variance (ANOVA)."
"How do you stay updated with the latest trends and tools in data analysis?","Stay updated by reading industry blogs, attending conferences, participating in webinars, and engaging in continuous learning through courses and certifications."
"What is the importance of data governance in an organization?","Data governance ensures data quality, security, and compliance, defining policies and procedures for managing data effectively across the organization."
"How do you handle conflicting data or results in your analysis?","Investigate the cause of the conflict by reviewing data sources, checking for errors or inconsistencies, and re-evaluating analytical methods. Seek additional data or consult with experts if necessary."
"What is a data warehouse, and how is it used in analysis?","A data warehouse is a centralized repository that stores and integrates data from various sources, enabling comprehensive analysis and reporting across different business areas."
"What are the benefits of using advanced analytics techniques?","Advanced analytics techniques, such as machine learning and predictive modeling, provide deeper insights, better forecasting, and more accurate decision-making based on complex data patterns."
"How do you approach building a data model?","Define the problem and objectives, gather and prepare data, select appropriate modeling techniques, train and validate the model, and evaluate its performance before deployment."
"What are some examples of tools and software commonly used by Senior Analysts?","Common tools include Excel, SQL, Python, R, Tableau, Power BI, and statistical software like SAS or SPSS."
"What is A/B testing, and how is it used in analysis?","A/B testing involves comparing two versions of a variable to determine which one performs better, often used for optimizing marketing strategies or user experiences."
"How do you deal with data privacy and ethical considerations in analysis?","Ensure data privacy by adhering to regulations (e.g., GDPR), anonymizing sensitive data, and following ethical guidelines for data use and analysis."
"What is the role of data cleaning in the analysis process?","Data cleaning involves identifying and correcting errors or inconsistencies in the data to ensure accuracy and reliability in the analysis results."
"What are some strategies for improving data quality?","Strategies include implementing data validation rules, regular audits, data cleaning processes, and establishing data quality standards and governance practices."
"How do you use predictive analytics in decision-making?","Predictive analytics uses historical data and statistical models to forecast future trends and behaviors, helping organizations make informed decisions and plan for potential scenarios."
"What is the significance of data integration in analytics?","Data integration combines data from different sources into a unified view, providing a more comprehensive understanding and enabling more accurate and insightful analysis."
"How do you approach analyzing unstructured data?","Analyze unstructured data using text mining, natural language processing (NLP), and sentiment analysis techniques to extract valuable insights and patterns."
"What is a SWOT analysis, and how is it used in business strategy?","SWOT analysis is a strategic planning tool that identifies strengths, weaknesses, opportunities, and threats related to a business or project, helping to inform strategic decisions."
"What are some best practices for writing and presenting analytical reports?","Best practices include clearly defining objectives, structuring the report logically, using visualizations effectively, summarizing key findings, and tailoring the presentation to the audience."
"What is the role of machine learning in data analysis?","Machine learning algorithms can identify patterns, make predictions, and provide insights from large and complex data sets, enhancing the analytical capabilities beyond traditional methods."
"What is data triangulation, and why is it important?","Data triangulation involves using multiple data sources or methods to cross-verify results, increasing the validity and reliability of the analysis."
"How do you approach working with cross-functional teams?","Collaborate effectively by understanding team members' needs, communicating clearly, sharing insights, and aligning analytical efforts with broader business objectives."
"What is a dashboard, and how is it used in data analysis?","A dashboard is a visual display of key metrics and data visualizations that provides an overview of performance and trends, helping stakeholders monitor and analyze important indicators."
"What are the key considerations when designing a data analysis strategy?","Considerations include defining clear objectives, understanding the data sources, selecting appropriate analytical methods, ensuring data quality, and aligning with business goals."
"How do you evaluate the success of a data analysis project?","Evaluate success by measuring the impact of the analysis on decision-making, assessing the accuracy and relevance of insights, and obtaining feedback from stakeholders."
